"id","username","date","time","tweet","replies_count","retweets_count","likes_count","mentions","pos_neg","pos","neg"
,"realdonaldtrump",2019-09-03,"21:12:02","....And then, think what happens to China when I win. Deal would get MUCH TOUGHER! In the meantime, China’s Supply Chain will crumble and businesses, jobs and money will be gone!",6865,11810,58775,"[]","Neutral",0.388111,0.611889
,"realdonaldtrump",2019-09-03,"21:12:02","We are doing very well in our negotiations with China. While I am sure they would love to be dealing with a new administration so they could continue their practice of “ripoff USA”($600 B/year),16 months PLUS is a long time to be hemorrhaging jobs and companies on a long-shot....",6912,15536,76293,"[]","Positive",0.991299,0.00870124
,"realdonaldtrump",2019-09-01,"20:25:29","....is about American Freedom. Redirect the supply chain. There is no reason to buy everything from China!",4560,11028,54526,"[]","Positive",0.772195,0.227805
,"realdonaldtrump",2019-09-01,"20:25:28","Peter Morici, Economist: Tariffs will not impact American consumers that much because the Chinese currency has gone down, which gives our importers a discount. Importers can find suppliers outside of China. Absolutely worth it, we don’t want to be servants to the Chinese! This...",5390,13475,62414,"[]","Neutral",0.454894,0.545106
,"realdonaldtrump",2019-09-01,"02:29:37","Just watched Congresswoman Debbie Dingell, and many other Democrats, wanting to give up on our very successful Trade battle with China, which has had its worst Economic year in memory (and getting worse). We are taking in $Billions. Will be big for Farmers and ALL!",11901,14399,64325,"[]","Positive",0.911561,0.088439
,"realdonaldtrump",2019-08-30,"20:06:41","General Motors, which was once the Giant of Detroit, is now one of the smallest auto manufacturers there. They moved major plants to China, BEFORE I CAME INTO OFFICE. This was done despite the saving help given them by the USA. Now they should start moving back to America again?",9592,15821,74816,"[]","Neutral",0.497328,0.502672
,"realdonaldtrump",2019-08-28,"20:06:23","So interesting to read and see all of the free and interesting advice I am getting on China, from people who have tried to handle it before and failed miserably - In fact, they got taken to the cleaners. We are doing very well with China. This has never happened to them before!",13077,22442,106203,"[]","Positive",0.930105,0.0698946
,"realdonaldtrump",2019-08-26,"07:10:47","In France we are all laughing at how knowingly inaccurate the U.S. reporting of events and conversations at the G-7 is. These Leaders, and many others, are getting a major case study of Fake News at it’s finest! They’ve got it all wrong, from Iran, to China Tariffs, to Boris!",17830,21029,82013,"[]","Positive",0.98307,0.0169295
,"realdonaldtrump",2019-08-24,"23:00:34","When I looked up to the sky and jokingly said “I am the chosen one,” at a press conference two days ago, referring to taking on Trade with China, little did I realize that the media would claim that I had a “Messiah complex.” They knew I was kidding, being sarcastic, and just....",25059,24474,129652,"[]","Positive",0.917478,0.0825217
,"realdonaldtrump",2019-08-24,"11:58:32","For all of the Fake News Reporters that don’t have a clue as to what the law is relative to Presidential powers, China, etc., try looking at the Emergency Economic Powers Act of 1977. Case closed!",22127,21453,86286,"[]","Positive",0.868856,0.131144
,"realdonaldtrump",2019-08-24,"05:00:33","...Additionally, the remaining 300 BILLION DOLLARS of goods and products from China, that was being taxed from September 1st at 10%, will now be taxed at 15%. Thank you for your attention to this matter!",11602,15673,69831,"[]","Positive",0.999525,0.000474863
,"realdonaldtrump",2019-08-24,"05:00:33","...unfair Trading Relationship. China should not have put new Tariffs on 75 BILLION DOLLARS of United States product (politically motivated!). Starting on October 1st, the 250 BILLION DOLLARS of goods and products from China, currently being taxed at 25%, will be taxed at 30%...",3910,14294,63403,"[]","Positive",0.987322,0.012678
,"realdonaldtrump",2019-08-24,"05:00:32","....Sadly, past Administrations have allowed China to get so far ahead of Fair and Balanced Trade that it has become a great burden to the American Taxpayer. As President, I can no longer allow this to happen! In the spirit of achieving Fair Trade, we must Balance this very....",1647,7166,27839,"[]","Positive",0.985895,0.0141046
,"realdonaldtrump",2019-08-24,"05:00:32","For many years China (and many other countries) has been taking advantage of the United States on Trade, Intellectual Property Theft, and much more. Our Country has been losing HUNDREDS OF BILLIONS OF DOLLARS a year to China, with no end in sight....",10440,19331,83059,"[]","Positive",0.979956,0.0200438
,"realdonaldtrump",2019-08-23,"22:59:05","....all deliveries of Fentanyl from China (or anywhere else!). Fentanyl kills 100,000 Americans a year. President Xi said this would stop - it didn’t. Our Economy, because of our gains in the last 2 1/2 years, is MUCH larger than that of China. We will keep it that way!",14125,20333,89482,"[]","Positive",0.983414,0.0165862
,"realdonaldtrump",2019-08-23,"22:59:04","....your companies HOME and making your products in the USA. I will be responding to China’s Tariffs this afternoon. This is a GREAT opportunity for the United States. Also, I am ordering all carriers, including Fed Ex, Amazon, UPS and the Post Office, to SEARCH FOR & REFUSE,....",10496,17796,79223,"[]","Positive",0.999913,0.000086737
,"realdonaldtrump",2019-08-23,"22:59:04","....better off without them. The vast amounts of money made and stolen by China from the United States, year after year, for decades, will and must STOP. Our great American companies are hereby ordered to immediately start looking for an alternative to China, including bringing..",17993,13670,52517,"[]","Positive",0.943614,0.0563862
,"realdonaldtrump",2019-08-23,"22:59:03","Our Country has lost, stupidly, Trillions of Dollars with China over many years. They have stolen our Intellectual Property at a rate of Hundreds of Billions of Dollars a year, & they want to continue. I won’t let that happen! We don’t need China and, frankly, would be far....",25458,32073,128151,"[]","Negative",0.174329,0.825671
,"realdonaldtrump",2019-08-21,"20:52:27","Doing great with China and other Trade Deals. The only problem we have is Jay Powell and the Fed. He’s like a golfer who can’t putt, has no touch. Big U.S. growth if he does the right thing, BIG CUT - but don’t count on him! So far he has called it wrong, and only let us down....",8366,13722,63368,"[]","Positive",0.997549,0.00245068
,"realdonaldtrump",2019-08-19,"03:24:09","Our economy is the best in the world, by far. Lowest unemployment ever within almost all categories. Poised for big growth after trade deals are completed. Import prices down, China eating Tariffs. Helping targeted Farmers from big Tariff money coming in. Great future for USA!",14938,16944,73373,"[]","Positive",0.997985,0.00201468
,"realdonaldtrump",2019-08-19,"02:27:56","We are doing very well with China, and talking!",11916,13267,80913,"[]","Positive",0.801153,0.198847
,"realdonaldtrump",2019-08-16,"04:14:16","“If they don’t get this Trade Deal with the U.S. done, China could have it first recession (or worse!) in years. There’s disinvestment in China right now. Also, the Fed is too tight (I agree).” Steve Moore, Heritage Foundation",7724,14154,62078,"[]","Neutral",0.675392,0.324608
,"realdonaldtrump",2019-08-16,"03:29:19","Biden doesn’t have a clue! I will solve the China problem.  https://twitter.com/kimguilfoyle/status/1161681065104347136 …",10473,12498,53867,"[]","Positive",0.972047,0.0279534
,"realdonaldtrump",2019-08-16,"00:52:53","The Fake News Media is doing everything they can to crash the economy because they think that will be bad for me and my re-election. The problem they have is that the economy is way too strong and we will soon be winning big on Trade, and everyone knows that, including China!",23648,19637,76030,"[]","Neutral",0.591588,0.408412
,"realdonaldtrump",2019-08-15,"06:59:13","I know President Xi of China very well. He is a great leader who very much has the respect of his people. He is also a good man in a “tough business.” I have ZERO doubt that if President Xi wants to quickly and humanely solve the Hong Kong problem, he can do it. Personal meeting?",26901,21484,99926,"[]","Positive",0.999762,0.000238486
,"realdonaldtrump",2019-08-15,"06:32:56","..deferral to December. It actually helps China more than us, but will be reciprocated. Millions of jobs are being lost in China to other non-Tariffed countries. Thousands of companies are leaving. Of course China wants to make a deal. Let them work humanely with Hong Kong first!",8847,15675,81562,"[]","Positive",0.995099,0.00490057
,"realdonaldtrump",2019-08-15,"06:32:56","Good things were stated on the call with China the other day. They are eating the Tariffs with the devaluation of their currency and “pouring” money into their system. The American consumer is fine with or without the September date, but much good will come from the short.....",8861,15768,84290,"[]","Negative",0.0759755,0.924024
,"realdonaldtrump",2019-08-15,"03:21:05","We are winning, big time, against China. Companies & jobs are fleeing. Prices to us have not gone up, and in some cases, have come down. China is not our problem, though Hong Kong is not helping. Our problem is with the Fed. Raised too much & too fast. Now too slow to cut....",18321,17320,81227,"[]","Positive",0.842343,0.157657
,"realdonaldtrump",2019-08-13,"22:10:58","As usual, China said they were going to be buying “big” from our great American Farmers. So far they have not done what they said. Maybe this will be different!",8795,10606,51215,"[]","Neutral",0.460469,0.539531
,"realdonaldtrump",2019-08-13,"20:49:05","Through massive devaluation of their currency and pumping vast sums of money into their system, the tens of billions of dollars that the U.S. is receiving is a gift from China. Prices not up, no inflation. Farmers getting more than China would be spending. Fake News won’t report!",11615,15649,62473,"[]","Negative",0.0030478,0.996952
,"realdonaldtrump",2019-08-11,"05:58:09","China wants to make a deal so badly. Thousands of companies are leaving because of the Tariffs, they must stem the flow. At the same time China may be hoping for a Democrat to win so they could continue the great ripoff of America, & the theft of hundreds of Billions of $’s!",10421,17505,77472,"[]","Negative",0.134876,0.865124
,"realdonaldtrump",2019-08-08,"03:01:41","Watching Sleepy Joe Biden making a speech. Sooo Boring! The LameStream Media will die in the ratings and clicks with this guy. It will be over for them, not to mention the fact that our Country will do poorly with him. It will be one big crash, but at least China will be happy!",31465,15375,70070,"[]","Negative",0.129095,0.870905
,"realdonaldtrump",2019-08-07,"20:46:22","“Three more Central Banks cut rates.” Our problem is not China - We are stronger than ever, money is pouring into the U.S. while China is losing companies by the thousands to other countries, and their currency is under siege - Our problem is a Federal Reserve that is too.....",8031,17811,81553,"[]","Positive",0.98436,0.01564
,"realdonaldtrump",2019-08-07,"01:51:23",".@sundarpichai of Google was in the Oval Office working very hard to explain how much he liked me, what a great job the Administration is doing, that Google was not involved with China’s military, that they didn’t help Crooked Hillary over me in the 2016 Election, & that they...",9282,16966,75766,"['sundarpichai']","Positive",0.97441,0.0255897
,"realdonaldtrump",2019-08-06,"20:36:44","As they have learned in the last two years, our great American Farmers know that China will not be able to hurt them in that their President has stood with them and done what no other president would do - And I’ll do it again next year if necessary!",24238,18286,92968,"[]","Positive",0.986137,0.0138625
,"realdonaldtrump",2019-08-06,"20:00:41","Massive amounts of money from China and other parts of the world is pouring into the United States for reasons of safety, investment, and interest rates! We are in a very strong position. Companies are also coming to the U.S. in big numbers. A beautiful thing to watch!",13358,17560,79060,"[]","Positive",0.995766,0.00423411
,"realdonaldtrump",2019-08-06,"00:00:14","China is intent on continuing to receive the hundreds of Billions of Dollars they have been taking from the U.S. with unfair trade practices and currency manipulation. So one-sided, it should have been stopped many years ago!",9121,14629,67795,"[]","Neutral",0.708315,0.291685
,"realdonaldtrump",2019-08-05,"23:58:59","Based on the historic currency manipulation by China, it is now even more obvious to everyone that Americans are not paying for the Tariffs – they are being paid for compliments of China, and the U.S. is taking in tens of Billions of Dollars! China has always....",8257,16400,87058,"[]","Positive",0.992757,0.00724334
,"realdonaldtrump",2019-08-05,"20:12:44","China dropped the price of their currency to an almost a historic low. It’s called “currency manipulation.” Are you listening Federal Reserve? This is a major violation which will greatly weaken China over time!",13065,20508,82678,"[]","Positive",0.956445,0.0435551
,"realdonaldtrump",2019-08-03,"20:46:45","Things are going along very well with China. They are paying us Tens of Billions of Dollars, made possible by their monetary devaluations and pumping in massive amounts of cash to keep their system going. So far our consumer is paying nothing - and no inflation. No help from Fed!",20451,16997,77533,"[]","Negative",0.0288709,0.971129
,"realdonaldtrump",2019-08-02,"01:26:11","...We look forward to continuing our positive dialogue with China on a comprehensive Trade Deal, and feel that the future between our two countries will be a very bright one!",7004,12149,66359,"[]","Positive",0.999438,0.000562379
,"realdonaldtrump",2019-08-02,"01:26:10","...during the talks the U.S. will start, on September 1st, putting a small additional Tariff of 10% on the remaining 300 Billion Dollars of goods and products coming from China into our Country. This does not include the 250 Billion Dollars already Tariffed at 25%...",5052,13462,66742,"[]","Positive",0.99676,0.00323986
,"realdonaldtrump",2019-08-02,"01:26:09","Our representatives have just returned from China where they had constructive talks having to do with a future Trade Deal. We thought we had a deal with China three months ago, but sadly, China decided to re-negotiate the deal prior to signing. More recently, China agreed to...",8066,15519,76915,"[]","Positive",0.849487,0.150513
,"realdonaldtrump",2019-08-01,"22:24:26","China, Iran & other foreign countries are looking at the Democrat Candidates and “drooling” over the small prospect that they could be dealing with them in the not too distant future. They would be able to rip off our beloved USA like never before. With President Trump, NO WAY!",10520,18332,79887,"[]","Neutral",0.306961,0.693039
,"realdonaldtrump",2019-08-01,"04:41:17","What the Market wanted to hear from Jay Powell and the Federal Reserve was that this was the beginning of a lengthy and aggressive rate-cutting cycle which would keep pace with China, The European Union and other countries around the world....",3407,14025,67842,"[]","Positive",0.956255,0.0437447
,"realdonaldtrump",2019-07-30,"20:40:03","China has lost 5 million jobs and two million manufacturing jobs due to the Trump Tariffs. Trumps got China back on its heels, and the United States is doing great. @AndyPuzder @MariaBartiromo",7948,13243,57385,"['andypuzder', 'mariabartiromo']","Positive",0.999481,0.000518554
,"realdonaldtrump",2019-07-30,"19:09:59","China is doing very badly, worst year in 27 - was supposed to start buying our agricultural product now - no signs that they are doing so. That is the problem with China, they just don’t come through. Our Economy has become MUCH larger than the Chinese Economy is last 3 years....",7026,17346,90130,"[]","Neutral",0.675856,0.324144
,"realdonaldtrump",2019-07-29,"21:18:14","....countries that know how to play the game against the U.S. That’s actually why the E.U. was formed....and for China, until now, the U.S. has been “easy pickens.” The Fed has made all of the wrong moves. A small rate cut is not enough, but we will win anyway!",6142,12735,64020,"[]","Neutral",0.281426,0.718574
,"realdonaldtrump",2019-07-29,"19:48:54","The E.U. and China will further lower interest rates and pump money into their systems, making it much easier for their manufacturers to sell product. In the meantime, and with very low inflation, our Fed does nothing - and probably will do very little by comparison. Too bad!",5388,13285,57092,"[]","Negative",0.00149435,0.998506
,"realdonaldtrump",2019-07-26,"23:25:07","Apple will not be given Tariff waiver, or relief, for Mac Pro parts that are made in China. Make them in the USA, no Tariffs!",10393,21388,101592,"[]","Positive",0.931133,0.0688667
,"realdonaldtrump",2019-07-26,"22:02:46","There may or may not be National Security concerns with regard to Google and their relationship with China. If there is a problem, we will find out about it. I sincerely hope there is not!!!",10338,19170,90341,"[]","Neutral",0.658161,0.341839
,"realdonaldtrump",2019-07-23,"19:54:02","Farmers are starting to do great again, after 15 years of a downward spiral. The 16 Billion Dollar China “replacement” money didn’t exactly hurt!",11389,10919,55960,"[]","Positive",0.847069,0.152931
,"realdonaldtrump",2019-07-15,"18:43:20","....with the U.S., and wishes it had not broken the original deal in the first place. In the meantime, we are receiving Billions of Dollars in Tariffs from China, with possibly much more to come. These Tariffs are paid for by China devaluing & pumping, not by the U.S. taxpayer!",7327,15621,87923,"[]","Negative",0.00139147,0.998609
,"realdonaldtrump",2019-07-15,"18:43:19","China’s 2nd Quarter growth is the slowest it has been in more than 27 years. The United States Tariffs are having a major effect on companies wanting to leave China for non-tariffed countries. Thousands of companies are leaving. This is why China wants to make a deal....",6184,19178,103242,"[]","Negative",0.0223656,0.977634
,"realdonaldtrump",2019-07-12,"20:48:03",".....if Mexico produces (which I think they will). Biggest part of deal with Mexico has not yet been revealed! China is similar, except they devalue currency & subsidize companies to lessen effect of 25% Tariffs. So far, little effect to consumers. Companies will relocate to U.S.",2847,9107,47309,"[]","Negative",0.00754896,0.992451
,"realdonaldtrump",2019-07-11,"22:04:16","Mexico is doing great at the Border, but China is letting us down in that they have not been buying the agricultural products from our great Farmers that they said they would. Hopefully they will start soon!",6124,10593,47764,"[]","Positive",0.99905,0.000950213
,"realdonaldtrump",2019-07-06,"20:45:50","Joe Biden is a reclamation project. Some things are just not salvageable. China and other countries that ripped us off for years are begging for him. He deserted our military, our law enforcement and our healthcare. Added more debt than all other Presidents combined. Won’t win!",34654,26515,122696,"[]","Positive",0.998955,0.00104488
,"realdonaldtrump",2019-07-03,"22:21:52","China and Europe playing big currency manipulation game and pumping money into their system in order to compete with USA. We should MATCH, or continue being the dummies who sit back and politely watch as other countries continue to play their games - as they have for many years!",7454,15560,64806,"[]","Neutral",0.382097,0.617903
,"realdonaldtrump",2019-06-30,"06:32:40","....again with China as our relationship with them continues to be a very good one. The quality of the transaction is far more important to me than speed. I am in no hurry, but things look very good! There will be no reduction in the Tariffs currently being charged to China.",3526,13234,79605,"[]","Positive",0.892977,0.107023
,"realdonaldtrump",2019-06-30,"06:32:38","I had a great meeting with President Xi of China yesterday, far better than expected. I agreed not to increase the already existing Tariffs that we charge China while we continue to negotiate. China has agreed that, during the negotiation, they will begin purchasing large.....",4634,17207,99361,"[]","Positive",0.999974,0.0000256006
,"realdonaldtrump",2019-06-29,"06:51:41","After some very important meetings, including my meeting with President Xi of China, I will be leaving Japan for South Korea (with President Moon). While there, if Chairman Kim of North Korea sees this, I would meet him at the Border/DMZ just to shake his hand and say Hello(?)!",34699,35240,158338,"[]","Positive",0.99985,0.000150159
,"realdonaldtrump",2019-06-24,"20:08:01","China gets 91% of its Oil from the Straight, Japan 62%, & many other countries likewise. So why are we protecting the shipping lanes for other countries (many years) for zero compensation. All of these countries should be protecting their own ships on what has always been....",14732,26345,130114,"[]","Positive",0.950296,0.0497036
,"realdonaldtrump",2019-06-18,"21:39:38","Had a very good telephone conversation with President Xi of China. We will be having an extended meeting next week at the G-20 in Japan. Our respective teams will begin talks prior to our meeting.",7110,15957,78126,"[]","Positive",0.999724,0.000275965
,"realdonaldtrump",2019-06-18,"18:53:44","Mario Draghi just announced more stimulus could come, which immediately dropped the Euro against the Dollar, making it unfairly easier for them to compete against the USA. They have been getting away with this for years, along with China and others.",6150,13196,54722,"[]","Negative",0.165589,0.834411
,"realdonaldtrump",2019-06-13,"11:50:45","“Biden would be China’s Dream Candidate, because there would be no more Tariffs, no more demands that China stop stealing our IP, things would go back to the old days with America’s manufacturers & workers getting shafted. He has Zero Credibility!” @IngrahamAngle  So true!",6800,15467,62814,"['ingrahamangle']","Negative",0.00951355,0.990486
,"realdonaldtrump",2019-06-11,"21:14:13","....If Mexico produces (which I think they will). Biggest part of deal with Mexico has not yet been revealed! China is similar, except they devalue currency and subsidize companies to lessen effect of 25% Tariff. So far, little effect to consumer. Companies will relocate to U.S.",6190,12036,64902,"[]","Negative",0.00776601,0.992234
,"realdonaldtrump",2019-06-08,"00:36:55","China is subsidizing its product in order that it can continue to be sold in the USA. Many firms are leaving China for other countries, including the United States, in order to avoid paying the Tariffs. No visible increase in costs or inflation, but U.S. is taking in Billions!",8181,14216,63437,"[]","Positive",0.990196,0.00980444
,"realdonaldtrump",2019-06-03,"18:07:11","China is subsidizing its product in order that it can continue to be sold in the USA. Many firms are leaving China for other countries, including the United States, in order to avoid paying the Tariffs. No visible increase in costs or inflation, but U.S. is taking Billions!",8840,15183,68992,"[]","Positive",0.990196,0.00980444
,"realdonaldtrump",2019-06-02,"04:37:03","Washington Post got it wrong, as usual. The U.S. is charging 25% against 250 Billion Dollars of goods shipped from China, not 200 BD. Also, China is paying a heavy cost in that they will subsidize goods to keep them coming, devalue their currency, yet companies are moving to.....",7257,16631,83466,"[]","Positive",0.891359,0.108641
,"realdonaldtrump",2019-05-20,"22:08:04","Looks like Bernie Sanders is history. Sleepy Joe Biden is pulling ahead and think about it, I’m only here because of Sleepy Joe and the man who took him off the 1% trash heap, President O! China wants Sleepy Joe BADLY!",25985,22369,104903,"[]","Negative",0.00825068,0.991749
,"realdonaldtrump",2019-05-14,"20:35:41","China will be pumping money into their system and probably reducing interest rates, as always, in order to make up for the business they are, and will be, losing. If the Federal Reserve ever did a “match,” it would be game over, we win! In any event, China wants a deal!",12693,15323,67326,"[]","Neutral",0.604577,0.395423
,"realdonaldtrump",2019-05-14,"19:29:35","....This money will come from the massive Tariffs being paid to the United States for allowing China, and others, to do business with us. The Farmers have been “forgotten” for many years. Their time is now!",8961,12320,64357,"[]","Positive",0.9759,0.0241003
,"realdonaldtrump",2019-05-14,"19:29:35","Our great Patriot Farmers will be one of the biggest beneficiaries of what is happening now. Hopefully China will do us the honor of continuing to buy our great farm product, the best, but if not your Country will be making up the difference based on a very high China buy......",11359,14209,73298,"[]","Positive",0.999752,0.000247987
,"realdonaldtrump",2019-05-14,"19:16:58","....of the tremendous ground we have lost to China on Trade since the ridiculous one sided formation of the WTO. It will all happen, and much faster than people think!",3455,13965,79790,"[]","Negative",0.0123216,0.987678
