"id","username","date","time","tweet","replies_count","retweets_count","likes_count","mentions","pos_neg","pos","neg"
,"realdonaldtrump",2019-05-14,"19:16:58","When the time is right we will make a deal with China. My respect and friendship with President Xi is unlimited but, as I have told him many times before, this must be a great deal for the United States or it just doesn’t make any sense. We have to be allowed to make up some.....",6510,18222,100452,"[]","Positive",0.997819,0.00218054
,"realdonaldtrump",2019-05-14,"18:51:41","We can make a deal with China tomorrow, before their companies start leaving so as not to lose USA business, but the last time we were close they wanted to renegotiate the deal. No way! We are in a much better position now than any deal we could have made. Will be taking in.....",4981,14243,72176,"[]","Neutral",0.513044,0.486956
,"realdonaldtrump",2019-05-14,"18:31:11","....so that they will be more competitive for USA buyers. We are now a much bigger economy than China, and have substantially increased in size since the great 2016 Election. We are the “piggy bank” that everyone wants to raid and take advantage of. NO MORE!",4075,12936,67117,"[]","Positive",0.988392,0.0116085
,"realdonaldtrump",2019-05-14,"18:31:10","China buys MUCH less from us than we buy from them, by almost 500 Billion Dollars, so we are in a fantastic position. Make your product at home in the USA and there is no Tariff. You can also buy from a non-Tariffed country instead of China. Many companies are leaving China.....",8003,17709,87865,"[]","Positive",0.999958,0.0000419648
,"realdonaldtrump",2019-05-14,"18:15:50","In one year Tariffs have rebuilt our Steel Industry - it is booming! We placed a 25% Tariff on “dumped” steel from China & other countries, and we now have a big and growing industry. We had to save Steel for our defense and auto industries, both of which are coming back strong!",8985,16732,75211,"[]","Positive",0.989254,0.0107463
,"realdonaldtrump",2019-05-13,"23:55:23","..There will be nobody left in China to do business with. Very bad for China, very good for USA! But China has taken so advantage of the U.S. for so many years, that they are way ahead (Our Presidents did not do the job). Therefore, China should not retaliate-will only get worse!",11275,14813,74395,"[]","Positive",0.901859,0.098141
,"realdonaldtrump",2019-05-13,"23:55:22","...completely avoided if you buy from a non-Tariffed Country, or you buy the product inside the USA (the best idea). That’s Zero Tariffs. Many Tariffed companies will be leaving China for Vietnam and other such countries in Asia. That’s why China wants to make a deal so badly!...",5192,13163,69192,"[]","Neutral",0.396364,0.603636
,"realdonaldtrump",2019-05-13,"23:55:22","There is no reason for the U.S. Consumer to pay the Tariffs, which take effect on China today. This has been proven recently when only 4 points were paid by the U.S., 21 points by China because China subsidizes product to such a large degree. Also, the Tariffs can be.....",13685,16723,82775,"[]","Positive",0.999834,0.0001655
,"realdonaldtrump",2019-05-13,"19:02:18","The unexpectedly good first quarter 3.2% GDP was greatly helped by Tariffs from China. Some people just don’t get it!",9018,11891,54463,"[]","Positive",0.854959,0.145041
,"realdonaldtrump",2019-05-13,"18:49:24","I say openly to President Xi & all of my many friends in China that China will be hurt very badly if you don’t make a deal because companies will be forced to leave China for other countries. Too expensive to buy in China. You had a great deal, almost completed, & you backed out!",12281,18325,81134,"[]","Negative",0.0194018,0.980598
,"realdonaldtrump",2019-05-13,"07:22:39","China is DREAMING that Sleepy Joe Biden, or any of the others, gets elected in 2020. They LOVE ripping off America!",14285,16930,74763,"[]","Negative",0.104597,0.895403
,"realdonaldtrump",2019-05-13,"05:06:05","....We will then spend (match or better) the money that China may no longer be spending with our Great Patriot Farmers (Agriculture), which is a small percentage of total Tariffs received, and distribute the food to starving people in nations around the world! GREAT! #MAGA",8943,13908,68802,"[]","Negative",0.0734865,0.926513
,"realdonaldtrump",2019-05-13,"05:06:05","We are right where we want to be with China. Remember, they broke the deal with us & tried to renegotiate. We will be taking in Tens of Billions of Dollars in Tariffs from China. Buyers of product can make it themselves in the USA (ideal), or buy it from non-Tariffed countries...",10485,17444,84468,"[]","Positive",0.953277,0.046723
,"realdonaldtrump",2019-05-12,"06:18:30","I think that China felt they were being beaten so badly in the recent negotiation that they may as well wait around for the next election, 2020, to see if they could get lucky & have a Democrat win - in which case they would continue to rip-off the USA for $500 Billion a year....",12436,23303,108281,"[]","Positive",0.995307,0.0046933
,"realdonaldtrump",2019-05-11,"03:14:04","....into the future will continue. In the meantime, the United States has imposed Tariffs on China, which may or may not be removed depending on what happens with respect to future negotiations!",6223,12826,68617,"[]","Neutral",0.712624,0.287376
,"realdonaldtrump",2019-05-11,"03:14:04","Over the course of the past two days, the United States and China have held candid and constructive conversations on the status of the trade relationship between both countries. The relationship between President Xi and myself remains a very strong one, and conversations....",7466,15554,81454,"[]","Positive",0.999624,0.000376254
,"realdonaldtrump",2019-05-10,"21:39:11","“We have been engaged in an unfair relationship with China for a long time. They have reneged on the commitments they made to the WTO, particularly around intellectual property.” Carly Fiorina @MariaBartiromo",6351,12600,52986,"['mariabartiromo']","Positive",0.990633,0.00936662
,"realdonaldtrump",2019-05-10,"20:55:27","Your all time favorite President got tired of waiting for China to help out and start buying from our FARMERS, the greatest anywhere in the World!",28273,19545,110338,"[]","Positive",0.984972,0.0150282
,"realdonaldtrump",2019-05-10,"20:07:24","....If we bought 15 Billion Dollars of Agriculture from our Farmers, far more than China buys now, we would have more than 85 Billion Dollars left over for new Infrastructure, Healthcare, or anything else. China would greatly slow down, and we would automatically speed up!",6826,13727,67690,"[]","Neutral",0.597862,0.402138
,"realdonaldtrump",2019-05-10,"19:48:26","Tariffs will make our Country MUCH STRONGER, not weaker. Just sit back and watch! In the meantime, China should not renegotiate deals with the U.S. at the last minute. This is not the Obama Administration, or the Administration of Sleepy Joe, who let China get away with “murder!”",7844,14577,58579,"[]","Negative",0.0875513,0.912449
,"realdonaldtrump",2019-05-10,"19:43:56","....agricultural products from our Great Farmers, in larger amounts than China ever did, and ship it to poor & starving countries in the form of humanitarian assistance. In the meantime we will continue to negotiate with China in the hopes that they do not again try to redo deal!",1642,5812,23858,"[]","Positive",0.97694,0.0230603
,"realdonaldtrump",2019-05-10,"19:43:56","....The process has begun to place additional Tariffs at 25% on the remaining 325 Billion Dollars. The U.S. only sells China approximately 100 Billion Dollars of goods & products, a very big imbalance. With the over 100 Billion Dollars in Tariffs that we take in, we will buy.....",1160,4550,17899,"[]","Positive",0.98961,0.0103897
,"realdonaldtrump",2019-05-10,"19:43:56","Talks with China continue in a very congenial manner - there is absolutely no need to rush - as Tariffs are NOW being paid to the United States by China of 25% on 250 Billion Dollars worth of goods & products. These massive payments go directly to the Treasury of the U.S....",11937,16386,83248,"[]","Positive",0.998568,0.00143205
,"realdonaldtrump",2019-05-10,"19:24:39","We have lost 500 Billion Dollars a year, for many years, on Crazy Trade with China. NO MORE!",7417,17483,75971,"[]","Positive",0.9426,0.0574001
,"realdonaldtrump",2019-05-09,"04:58:40","“The reality is, with the Tariffs, the economy has grown more rapidly in the United States and much more slowly in China.” Peter Morici, Former Chief Economist, USITC",6262,13023,59453,"[]","Negative",0.0810786,0.918921
,"realdonaldtrump",2019-05-08,"20:48:16","....Guess what, that’s not going to happen! China has just informed us that they (Vice-Premier) are now coming to the U.S. to make a deal. We’ll see, but I am very happy with over $100 Billion a year in Tariffs filling U.S. coffers...great for U.S., not good for China!",8853,15820,73302,"[]","Positive",0.999533,0.000466502
,"realdonaldtrump",2019-05-08,"20:48:15","The reason for the China pullback & attempted renegotiation of the Trade Deal is the sincere HOPE that they will be able to “negotiate” with Joe Biden or one of the very weak Democrats, and thereby continue to ripoff the United States (($500 Billion a year)) for years to come....",7735,18624,79068,"[]","Positive",0.86732,0.13268
,"realdonaldtrump",2019-05-06,"19:08:41","The United States has been losing, for many years, 600 to 800 Billion Dollars a year on Trade. With China we lose 500 Billion Dollars. Sorry, we’re not going to be doing that anymore!",14977,25054,112810,"[]","Negative",0.0556275,0.944372
,"realdonaldtrump",2019-05-06,"00:08:46","....of additional goods sent to us by China remain untaxed, but will be shortly, at a rate of 25%. The Tariffs paid to the USA have had little impact on product cost, mostly borne by China. The Trade Deal with China continues, but too slowly, as they attempt to renegotiate. No!",7973,16310,71755,"[]","Positive",0.760149,0.239851
,"realdonaldtrump",2019-05-06,"00:08:46","For 10 months, China has been paying Tariffs to the USA of 25% on 50 Billion Dollars of High Tech, and 10% on 200 Billion Dollars of other goods. These payments are partially responsible for our great economic results. The 10% will go up to 25% on Friday. 325 Billions Dollars....",13775,23644,96338,"[]","Positive",0.999717,0.00028309
,"realdonaldtrump",2019-05-04,"01:06:31","Had a long and very good conversation with President Putin of Russia. As I have always said, long before the Witch Hunt started, getting along with Russia, China, and everyone is a good thing, not a bad thing....",25064,25495,127689,"[]","Positive",0.996336,0.003664
,"realdonaldtrump",2019-05-01,"01:56:57","China is adding great stimulus to its economy while at the same time keeping interest rates low. Our Federal Reserve has incessantly lifted interest rates, even though inflation is very low, and instituted a very big dose of quantitative tightening. We have the potential to go...",4536,11913,50580,"[]","Positive",0.871387,0.128613
,"realdonaldtrump",2019-04-04,"20:01:15","Despite the unnecessary and destructive actions taken by the Fed, the Economy is looking very strong, the China and USMCA deals are moving along nicely, there is little or no Inflation, and USA optimism is very high!",7335,15314,70507,"[]","Negative",0.0211511,0.978849
,"realdonaldtrump",2019-03-18,"19:45:19","....are all coming back to the U.S. So is everyone else. We now have the best Economy in the World, the envy of all. Get that big, beautiful plant in Ohio open now. Close a plant in China or Mexico, where you invested so heavily pre-Trump, but not in the U.S.A. Bring jobs home!",8518,16453,81084,"[]","Positive",0.993125,0.00687452
,"realdonaldtrump",2019-03-17,"05:07:46","Google is helping China and their military, but not the U.S. Terrible! The good news is that they helped Crooked Hillary Clinton, and not Trump....and how did that turn out?",13522,22782,94413,"[]","Neutral",0.737542,0.262458
,"realdonaldtrump",2019-03-02,"07:08:11","I have asked China to immediately remove all Tariffs on our agricultural products (including beef, pork, etc.) based on the fact that we are moving along nicely with Trade discussions....",8580,20247,114472,"[]","Positive",0.949904,0.050096
,"realdonaldtrump",2019-02-27,"17:45:59","All false reporting (guessing) on my intentions with respect to North Korea. Kim Jong Un and I will try very hard to work something out on Denuclearization & then making North Korea an Economic Powerhouse. I believe that China, Russia, Japan & South Korea will be very helpful!",14449,19975,94064,"[]","Positive",0.992434,0.00756587
,"realdonaldtrump",2019-02-26,"08:04:49","If a deal is made with China, our great American Farmers will be treated better than they have ever been treated before!",11402,18976,103201,"[]","Positive",0.936766,0.0632339
,"realdonaldtrump",2019-02-26,"04:12:25","China Trade Deal (and more) in advanced stages. Relationship between our two Countries is very strong. I have therefore agreed to delay U.S. tariff hikes. Let’s see what happens?",5782,14149,73755,"[]","Negative",0.00331453,0.996685
,"realdonaldtrump",2019-02-25,"06:50:14","....productive talks, I will be delaying the U.S. increase in tariffs now scheduled for March 1. Assuming both sides make additional progress, we will be planning a Summit for President Xi and myself, at Mar-a-Lago, to conclude an agreement. A very good weekend for U.S. & China!",11859,19561,98621,"[]","Positive",0.763908,0.236092
,"realdonaldtrump",2019-02-25,"06:39:17","I am pleased to report that the U.S. has made substantial progress in our trade talks with China on important structural issues including intellectual property protection, technology transfer, agriculture, services, currency, and many other issues. As a result of these very......",7308,19810,102436,"[]","Positive",0.956882,0.0431181
,"realdonaldtrump",2019-02-24,"21:05:49","President Xi of China has been very helpful in his support of my meeting with Kim Jong Un. The last thing China wants are large scale nuclear weapons right next door. Sanctions placed on the border by China and Russia have been very helpful. Great relationship with Chairman Kim!",5305,14869,77249,"[]","Positive",0.999877,0.000123269
,"realdonaldtrump",2019-02-24,"20:58:20","Very productive talks yesterday with China on Trade. Will continue today! I will be leaving for Hanoi, Vietnam, early tomorrow for a Summit with Kim Jong Un of North Korea, where we both expect a continuation of the progress made at first Summit in Singapore. Denuclearization?",7252,16432,85872,"[]","Positive",0.983828,0.0161721
,"realdonaldtrump",2019-02-17,"20:00:26","Important meetings and calls on China Trade Deal, and more, today with my staff. Big progress being made on soooo many different fronts! Our Country has such fantastic potential for future growth and greatness on an even higher level!",9048,14793,73967,"[]","Positive",0.956555,0.0434452
,"realdonaldtrump",2019-02-17,"08:17:44","Trade negotiators have just returned from China where the meetings on Trade were very productive. Now at meetings with me at Mar-a-Lago giving the details. In the meantime, Billions of Dollars are being paid to the United States by China in the form of Trade Tariffs!",17044,19759,99825,"[]","Positive",0.998668,0.00133177
,"realdonaldtrump",2019-01-31,"22:56:15","Looking for China to open their Markets not only to Financial Services, which they are now doing, but also to our Manufacturing, Farmers and other U.S. businesses and industries. Without this a deal would be unacceptable!",5477,13788,67319,"[]","Positive",0.936022,0.0639779
,"realdonaldtrump",2019-01-31,"20:56:36","....China’s representatives and I are trying to do a complete deal, leaving NOTHING unresolved on the table. All of the many problems are being discussed and will be hopefully resolved. Tariffs on China increase to 25% on March 1st, so all working hard to complete by that date!",4798,11675,57026,"[]","Negative",0.0807078,0.919292
,"realdonaldtrump",2019-01-31,"20:41:56","China’s top trade negotiators are in the U.S. meeting with our representatives. Meetings are going well with good intent and spirit on both sides. China does not want an increase in Tariffs and feels they will do much better if they make a deal. They are correct. I will be......",3605,12486,62043,"[]","Positive",0.925403,0.0745968
,"realdonaldtrump",2019-01-22,"05:57:59","China posts slowest economic numbers since 1990 due to U.S. trade tensions and new policies. Makes so much sense for China to finally do a Real Deal, and stop playing around!",8195,18025,93078,"[]","Positive",0.751757,0.248243
,"realdonaldtrump",2019-01-15,"06:19:49","For decades, politicians promised to secure the border, fix our trade deals, bring back our factories, get tough on China, move the Embassy to Jerusalem, make NATO pay their fair share, and so much else - only to do NOTHING (or worse)....",17456,27966,129601,"[]","Positive",0.932429,0.0675711
,"realdonaldtrump",2019-01-08,"21:16:09","Talks with China are going very well!",20763,17236,116665,"[]","Neutral",0.716773,0.283227
,"realdonaldtrump",2019-01-04,"09:19:17","Michael Pillsbury interviewed by @cvpayne: “They have the motive of making the President look bad – instead of President Trump being portrayed as a HERO. The first President to take China on, it’s 20 years overdue....",16549,17955,89006,"['cvpayne']","Positive",0.999926,0.00007356
,"realdonaldtrump",2019-01-03,"22:52:13","The United States Treasury has taken in MANY billions of dollars from the Tariffs we are charging China and other countries that have not treated us fairly. In the meantime we are doing well in various Trade Negotiations currently going on. At some point this had to be done!",29513,19622,97939,"[]","Positive",0.998733,0.00126683
,"realdonaldtrump",2018-12-30,"00:03:02","Just had a long and very good call with President Xi of China. Deal is moving along very well. If made, it will be very comprehensive, covering all subjects, areas and points of dispute. Big progress being made!",24910,24372,133403,"[]","Positive",0.99502,0.00497974
,"realdonaldtrump",2018-12-21,"22:41:59","There has never been a president who has been tougher (but fair) on China or Russia - Never, just look at the facts. The Fake News tries so hard to paint the opposite picture.",23747,14802,70995,"[]","Positive",0.980388,0.019612
,"realdonaldtrump",2018-12-17,"21:27:16","It is incredible that with a very strong dollar and virtually no inflation, the outside world blowing up around us, Paris is burning and China way down, the Fed is even considering yet another interest rate hike. Take the Victory!",24454,21708,97442,"[]","Negative",0.184542,0.815458
,"realdonaldtrump",2018-12-15,"00:35:43","China just announced that their economy is growing much slower than anticipated because of our Trade War with them. They have just suspended U.S. Tariff Hikes. U.S. is doing very well. China wants to make a big and very comprehensive deal. It could happen, and rather soon!",19051,23670,117967,"[]","Negative",0.0184586,0.981541
,"realdonaldtrump",2018-12-11,"21:19:26","Very productive conversations going on with China! Watch for some important announcements!",10090,14350,74353,"[]","Neutral",0.513433,0.486567
,"realdonaldtrump",2018-12-07,"21:13:48","China talks are going very well!",13977,12735,81659,"[]","Neutral",0.717523,0.282477
,"realdonaldtrump",2018-12-07,"08:56:18","Statement from China: “The teams of both sides are now having smooth communications and good cooperation with each other. We are full of confidence that an agreement can be reached within the next 90 days.” I agree!",8524,15433,72255,"[]","Positive",0.958687,0.0413126
,"realdonaldtrump",2018-12-05,"21:51:07",".....considered to be the worst and most dangerous, addictive and deadly substance of them all. Last year over 77,000 people died from Fentanyl. If China cracks down on this “horror drug,” using the Death Penalty for distributors and pushers, the results will be incredible!",7112,15234,72525,"[]","Positive",0.906417,0.0935826
,"realdonaldtrump",2018-12-05,"21:44:10","One of the very exciting things to come out of my meeting with President Xi of China is his promise to me to criminalize the sale of deadly Fentanyl coming into the United States. It will now be considered a “controlled substance.” This could be a game changer on what is.......",4341,12616,60777,"[]","Positive",0.994991,0.00500855
,"realdonaldtrump",2018-12-05,"21:19:46","Very strong signals being sent by China once they returned home from their long trip, including stops, from Argentina. Not to sound naive or anything, but I believe President Xi meant every word of what he said at our long and hopefully historic meeting. ALL subjects discussed!",12809,14845,79099,"[]","Positive",0.980512,0.0194882
,"realdonaldtrump",2018-12-05,"20:49:48",".....China had agreed to start “immediately” buying U.S. products.” @business",5598,11367,57583,"['business']","Positive",0.936887,0.0631132
,"realdonaldtrump",2018-12-05,"20:46:28","“China officially echoed President Donald Trump’s optimism over bilateral trade talks. Chinese officials have begun preparing to restart imports of U.S. Soybeans & Liquified Natural Gas, the first sign confirming the claims of President Donald Trump and the White House that......",5006,12890,59762,"[]","Positive",0.999846,0.000153875
,"realdonaldtrump",2018-12-05,"08:21:41",".....China does not want Tariffs!",14186,11578,64621,"[]","Neutral",0.328055,0.671945
,"realdonaldtrump",2018-12-05,"08:20:27","We are either going to have a REAL DEAL with China, or no deal at all - at which point we will be charging major Tariffs against Chinese product being shipped into the United States. Ultimately, I believe, we will be making a deal - either now or into the future....",11788,15697,76537,"[]","Positive",0.922942,0.0770579
,"realdonaldtrump",2018-12-04,"23:10:00",".....But if a fair deal is able to be made with China, one that does all of the many things we know must be finally done, I will happily sign. Let the negotiations begin. MAKE AMERICA GREAT AGAIN!",6596,11291,54761,"[]","Positive",0.789006,0.210994
,"realdonaldtrump",2018-12-04,"22:55:35","......on seeing whether or not a REAL deal with China is actually possible. If it is, we will get it done. China is supposed to start buying Agricultural product and more immediately. President Xi and I want this deal to happen, and it probably will. But if not remember,......",4202,10130,50027,"[]","Neutral",0.624813,0.375187
,"realdonaldtrump",2018-12-04,"22:30:16","The negotiations with China have already started. Unless extended, they will end 90 days from the date of our wonderful and very warm dinner with President Xi in Argentina. Bob Lighthizer will be working closely with Steve Mnuchin, Larry Kudlow, Wilbur Ross and Peter Navarro.....",5980,12231,59228,"[]","Positive",0.999975,0.0000245273
,"realdonaldtrump",2018-12-03,"21:18:01","President Xi and I have a very strong and personal relationship. He and I are the only two people that can bring about massive and very positive change, on trade and far beyond, between our two great Nations. A solution for North Korea is a great thing for China and ALL!",5977,12460,59641,"[]","Positive",0.99821,0.00178978
,"realdonaldtrump",2018-12-03,"21:01:08","Farmers will be a a very BIG and FAST beneficiary of our deal with China. They intend to start purchasing agricultural product immediately. We make the finest and cleanest product in the World, and that is what China wants. Farmers, I LOVE YOU!",13206,22925,107540,"[]","Neutral",0.66149,0.33851
,"realdonaldtrump",2018-12-03,"20:54:30","My meeting in Argentina with President Xi of China was an extraordinary one. Relations with China have taken a BIG leap forward! Very good things will happen. We are dealing from great strength, but China likewise has much to gain if and when a deal is completed. Level the field!",5804,14259,67056,"[]","Positive",0.99983,0.00017002
,"realdonaldtrump",2018-12-03,"12:00:25","China has agreed to reduce and remove tariffs on cars coming into China from the U.S. Currently the tariff is 40%.",15127,27636,128995,"[]","Positive",0.969129,0.0308708
,"realdonaldtrump",2018-11-29,"20:32:13","Billions of Dollars are pouring into the coffers of the U.S.A. because of the Tariffs being charged to China, and there is a long way to go. If companies don’t want to pay Tariffs, build in the U.S.A. Otherwise, lets just make our Country richer than ever before!",22052,18702,85587,"[]","Positive",0.988544,0.0114565
,"realdonaldtrump",2018-11-28,"03:05:39","....for electric cars. General Motors made a big China bet years ago when they built plants there (and in Mexico) - don’t think that bet is going to pay off. I am here to protect America’s Workers!",16706,21512,99095,"[]","Neutral",0.737837,0.262163
,"realdonaldtrump",2018-11-28,"03:05:39","Very disappointed with General Motors and their CEO, Mary Barra, for closing plants in Ohio, Michigan and Maryland. Nothing being closed in Mexico & China. The U.S. saved General Motors, and this is the THANKS we get! We are now looking at cutting all @GM subsidies, including....",21870,26889,113288,"['gm']","Positive",0.985203,0.0147968
,"realdonaldtrump",2018-11-13,"19:50:41","Emmanuel Macron suggests building its own army to protect Europe against the U.S., China and Russia. But it was Germany in World Wars One & Two - How did that work out for France? They were starting to learn German in Paris before the U.S. came along. Pay for NATO or not!",31823,31144,112078,"[]","Positive",0.991922,0.00807751
